{
  "id": "decision-20260309-acc3pt",
  "type": "task_completion",
  "reference_id": "task-20260309-y4nd3x",
  "decision": "accept",
  "reasoning": "All 4 acceptance criteria met. Quality score 100/100. 118 tests pass. No code or test modifications were needed — purely an environment fix. Additionally fixed a macOS compatibility bug in check-duplication.sh discovered during QA.",
  "decided_by": "coordinator",
  "follow_up": "Consider adding venv setup instructions to QUICKSTART.md",
  "created_at": "2026-03-09T19:46:00Z"
}
